{
  "schemaVersion": 1,
  "id": "openai-2024-09-13-gpt-3-5-turbo-0613",
  "provider": "openai",
  "kind": "model-retirement",
  "title": "gpt-3.5-turbo-0613 shutdown",
  "summary": "Chat model updates. Shutdown date: 2024-09-13. Replacement: gpt-3.5-turbo.",
  "announcedOn": "2023-11-06",
  "effectiveOn": "2024-09-13",
  "breaking": true,
  "signatures": {
    "modelIds": ["gpt-3.5-turbo-0613"],
    "endpoints": [],
    "params": [],
    "symbols": [],
    "packages": [],
    "apiVersions": []
  },
  "replacement": {
    "value": "gpt-3.5-turbo",
    "modelIds": ["gpt-3.5-turbo"]
  },
  "migrationNotes": [],
  "sources": [
    {
      "url": "https://developers.openai.com/api/docs/deprecations.md",
      "quote": "| 2024-09-13    | `gpt-3.5-turbo-0613`     | $1.50 / 1M input tokens + $2.00 / 1M output tokens | `gpt-3.5-turbo`         |",
      "contentHash": "b5d1cafefc8a491f2c095d77359a6ca185498baa5f65a66bac1cb722e188855f",
      "checkedAt": "2026-10-24T14:37:23.481Z"
    }
  ],
  "extraction": {
    "method": "table"
  },
  "status": "confirmed",
  "quarantineReasons": []
}
