{
  "schemaVersion": 1,
  "id": "openai-2026-10-23-gpt-4-turbo",
  "provider": "openai",
  "kind": "model-retirement",
  "title": "gpt-4-turbo shutdown",
  "summary": "Legacy GPT model snapshots. Shutdown date: 2026-10-23. Replacement: gpt-5.6-sol.",
  "announcedOn": "2026-04-22",
  "effectiveOn": "2026-10-23",
  "breaking": true,
  "signatures": {
    "modelIds": ["gpt-4-turbo", "gpt-4-turbo-2024-04-09", "gpt-4-turbo-completions"],
    "endpoints": [],
    "params": [],
    "symbols": [],
    "packages": [],
    "apiVersions": []
  },
  "replacement": {
    "value": "gpt-5.6-sol",
    "modelIds": ["gpt-5.6-sol"]
  },
  "migrationNotes": [],
  "sources": [
    {
      "url": "https://developers.openai.com/api/docs/deprecations.md",
      "quote": "| October 23, 2026 | `gpt-4-turbo` \\| `gpt-4-turbo-2024-04-09`, `gpt-4-turbo-completions`   | `gpt-5.6-sol`                                     |",
      "contentHash": "b5d1cafefc8a491f2c095d77359a6ca185498baa5f65a66bac1cb722e188855f",
      "checkedAt": "2026-10-24T14:37:23.481Z"
    }
  ],
  "extraction": {
    "method": "table"
  },
  "status": "confirmed",
  "quarantineReasons": []
}
