{
  "schemaVersion": 1,
  "id": "openai-2025-06-06-gpt-4-32k-0613",
  "provider": "openai",
  "kind": "model-retirement",
  "title": "gpt-4-32k-0613 shutdown",
  "summary": "GPT-4-32K and Vision Preview models. Shutdown date: 2025-06-06. Replacement: gpt-4o.",
  "announcedOn": "2024-06-06",
  "effectiveOn": "2025-06-06",
  "breaking": true,
  "signatures": {
    "modelIds": ["gpt-4-32k-0613"],
    "endpoints": [],
    "params": [],
    "symbols": [],
    "packages": [],
    "apiVersions": []
  },
  "replacement": {
    "value": "gpt-4o",
    "modelIds": ["gpt-4o"]
  },
  "migrationNotes": [],
  "sources": [
    {
      "url": "https://developers.openai.com/api/docs/deprecations.md",
      "quote": "| 2025-06-06    | `gpt-4-32k-0613`            | $60.00 / 1M input tokens + $120 / 1M output tokens | `gpt-4o`                |",
      "contentHash": "b5d1cafefc8a491f2c095d77359a6ca185498baa5f65a66bac1cb722e188855f",
      "checkedAt": "2026-10-24T14:37:23.481Z"
    }
  ],
  "extraction": {
    "method": "table"
  },
  "status": "confirmed",
  "quarantineReasons": []
}
