{
  "schemaVersion": 1,
  "id": "openai-2022-12-03-v1-search",
  "provider": "openai",
  "kind": "endpoint-removal",
  "title": "/v1/search shutdown",
  "summary": "Legacy endpoints. Shutdown date: 2022-12-03. Replacement: View transition guide.",
  "announcedOn": "2022-06-03",
  "effectiveOn": "2022-12-03",
  "breaking": true,
  "signatures": {
    "modelIds": [],
    "endpoints": ["/v1/search"],
    "params": [],
    "symbols": [],
    "packages": [],
    "apiVersions": []
  },
  "replacement": {
    "value": "View transition guide",
    "modelIds": []
  },
  "migrationNotes": [],
  "sources": [
    {
      "url": "https://developers.openai.com/api/docs/deprecations.md",
      "quote": "| 2022-12-03    | `/v1/search`          | [View transition guide](https://help.openai.com/en/articles/6272952-search-transition-guide)          |",
      "contentHash": "b5d1cafefc8a491f2c095d77359a6ca185498baa5f65a66bac1cb722e188855f",
      "checkedAt": "2026-10-24T14:37:23.481Z"
    }
  ],
  "extraction": {
    "method": "table"
  },
  "status": "confirmed",
  "quarantineReasons": []
}
