{
  "schemaVersion": 1,
  "id": "stripe-2025-09-30-clover-stripejs-deprecated-elements-removal",
  "provider": "stripe",
  "title": "Removes deprecated messaging and bank elements that were replaced",
  "announcedOn": "2025-09-30",
  "effectiveOn": null,
  "breaking": true,
  "replacement": null,
  "extraction": {
    "method": "table"
  },
  "kind": "behaviour-change",
  "summary": "We removed deprecated elements for: This release removes the following deprecated elements for messaging and accepting payments from Stripe.js:",
  "signatures": {
    "modelIds": [],
    "params": [],
    "endpoints": [],
    "symbols": [],
    "packages": [],
    "apiVersions": ["2025-09-30.clover"]
  },
  "migrationNotes": [
    "If your integration uses the epsBank, fpxBank, p24Bank, or idealBank elements, update it to use the Payment Element instead. This new UI component for the web accepts 40+ payment methods, validates input, and handles errors.",
    "If your integration uses the affirmMessage or afterpayClearpayMessage elements, update it to use the Payment Method Messaging Element. The new element dynamically shows your customers relevant buy now, pay later payment options for their purchase."
  ],
  "sources": [
    {
      "url": "https://docs.stripe.com/changelog.md",
      "quote": "| [Removes deprecated messaging and bank elements that were replaced](https://docs.stripe.com/changelog/clover/2025-09-30/stripejs-deprecated-elements-removal.md) | Elements | Breaking | stripejs |",
      "contentHash": "0eef16b7bc6e9c3ce878cc105d526a425e55660bf3eaf3cdfc9a4f4b8980c103",
      "checkedAt": "2026-10-24T14:37:26.524Z"
    },
    {
      "url": "https://docs.stripe.com/changelog/clover/2025-09-30/stripejs-deprecated-elements-removal.md",
      "quote": "This release removes the following deprecated elements for messaging and accepting payments from Stripe.js:",
      "contentHash": "a0a486381435c91d28e0f4254bff3247979e4047713b86516f7e1c60c6ab1edd",
      "checkedAt": "2026-10-24T14:37:31.779Z"
    }
  ],
  "status": "confirmed",
  "quarantineReasons": []
}
