{
  "schemaVersion": 1,
  "id": "openai-2027-01-14-gpt-4-1-mini-2025-04-14",
  "provider": "openai",
  "kind": "model-retirement",
  "title": "gpt-4.1-mini-2025-04-14 shutdown",
  "summary": "GPT-4 series model deprecations. Shutdown date: 2027-01-14. Replacement: gpt-6-luna.",
  "announcedOn": "2026-10-14",
  "effectiveOn": "2027-01-14",
  "breaking": true,
  "signatures": {
    "modelIds": ["gpt-4.1-mini-2025-04-14"],
    "endpoints": [],
    "params": [],
    "symbols": [],
    "packages": [],
    "apiVersions": []
  },
  "replacement": {
    "value": "gpt-6-luna",
    "modelIds": ["gpt-6-luna"]
  },
  "migrationNotes": [],
  "sources": [
    {
      "url": "https://developers.openai.com/api/docs/deprecations.md",
      "quote": "| January 14, 2027 | GPT-4.1 mini (`gpt-4.1-mini-2025-04-14`)          | `gpt-6-luna`            |",
      "contentHash": "b5d1cafefc8a491f2c095d77359a6ca185498baa5f65a66bac1cb722e188855f",
      "checkedAt": "2026-10-24T14:37:23.481Z"
    }
  ],
  "extraction": {
    "method": "table"
  },
  "status": "confirmed",
  "quarantineReasons": []
}
