{
  "schemaVersion": 1,
  "id": "stripe-2025-03-31-basil-deprecate-total-count-expansion",
  "provider": "stripe",
  "title": "Removes total count expansion for list API methods",
  "announcedOn": "2025-03-31",
  "effectiveOn": null,
  "breaking": true,
  "replacement": null,
  "extraction": {
    "method": "table"
  },
  "kind": "behaviour-change",
  "summary": "You can no longer expand the total_count property in lists. New users can’t expand total_count on earlier Stripe versions. Attempting to expand total_count returns a 400 error with a property_forbidden error message. We don’t allow requests for total_count expansion for list API methods. To use this version, you must migrate your integration to solely rely on the has_more list response field instead.",
  "signatures": {
    "modelIds": [],
    "params": [],
    "endpoints": [],
    "symbols": [],
    "packages": [],
    "apiVersions": ["2025-03-31.basil"]
  },
  "migrationNotes": [
    "If your integration uses total_count for pagination and it sends include[]=total_count or exclude[]=total_count API parameters with your API request, you need to update your pagination integration to rely only on the has_more response field.",
    "Some top-level API resources always return total_count values for some of their list fields. You might notice this if you don’t add include[]=total_count or exclude[]=total_count to your request but you still receive total_count data as a part of the response. These API resources aren’t affected by this version change."
  ],
  "sources": [
    {
      "url": "https://docs.stripe.com/changelog.md",
      "quote": "| [Removes total count expansion for list API methods](https://docs.stripe.com/changelog/basil/2025-03-31/deprecate-total-count-expansion.md) | All products | Breaking | api |",
      "contentHash": "0eef16b7bc6e9c3ce878cc105d526a425e55660bf3eaf3cdfc9a4f4b8980c103",
      "checkedAt": "2026-10-24T14:37:26.524Z"
    },
    {
      "url": "https://docs.stripe.com/changelog/basil/2025-03-31/deprecate-total-count-expansion.md",
      "quote": "We don’t allow requests for `total_count` expansion for list API methods. To use this version, you must migrate your integration to solely rely on the `has_more` list response field instead.",
      "contentHash": "4f2aa0d6f5d122b095c878083967454056339ca7d2cfae59fe91eacdd73b2bab",
      "checkedAt": "2026-10-24T14:37:33.269Z"
    }
  ],
  "status": "confirmed",
  "quarantineReasons": []
}
