{
  "schemaVersion": 1,
  "id": "stripe-2019-02-11-v-renames-authorize-with-url-redirect-to-url",
  "provider": "stripe",
  "title": "Renames the `authorize_with_url` field for Payment Intents to `redirect_to_url`",
  "announcedOn": "2019-02-11",
  "effectiveOn": null,
  "breaking": true,
  "replacement": null,
  "extraction": {
    "method": "table"
  },
  "kind": "parameter-change",
  "summary": "Renames the authorize_with_url property on the PaymentIntent to redirect_to_url.",
  "signatures": {
    "modelIds": [],
    "params": ["authorize_with_url"],
    "endpoints": [],
    "symbols": ["authorize_with_url"],
    "packages": [
      {
        "ecosystem": "pypi",
        "name": "stripe"
      },
      {
        "ecosystem": "npm",
        "name": "stripe"
      }
    ],
    "apiVersions": ["2019-02-11"]
  },
  "migrationNotes": [
    "Update your code to reference redirect_to_url instead of authorize_with_url when handling URL-based authorization steps in the payment process."
  ],
  "sources": [
    {
      "url": "https://docs.stripe.com/changelog.md",
      "quote": "| [Renames the `authorize_with_url` field for Payment Intents to `redirect_to_url`](https://docs.stripe.com/changelog/2019-02-11/renames-authorize-with-url-redirect-to-url.md) | Payments | Breaking | api |",
      "contentHash": "0eef16b7bc6e9c3ce878cc105d526a425e55660bf3eaf3cdfc9a4f4b8980c103",
      "checkedAt": "2026-10-24T14:37:26.524Z"
    },
    {
      "url": "https://docs.stripe.com/changelog/2019-02-11/renames-authorize-with-url-redirect-to-url.md",
      "quote": "Renames the `authorize_with_url` property on the PaymentIntent to `redirect_to_url`.",
      "contentHash": "bd4136645da1873c65a0102db23d1e394636a50cdc9c5847db27def10c6d86fd",
      "checkedAt": "2026-10-24T14:37:39.069Z"
    }
  ],
  "status": "confirmed",
  "quarantineReasons": []
}
