{
  "schemaVersion": 1,
  "id": "openai-2024-01-04-v1-fine-tunes",
  "provider": "openai",
  "kind": "endpoint-removal",
  "title": "/v1/fine-tunes shutdown",
  "summary": "Fine-tunes endpoint. Shutdown date: 2024-01-04. Replacement: /v1/fine_tuning/jobs.",
  "announcedOn": "2023-08-22",
  "effectiveOn": "2024-01-04",
  "breaking": true,
  "signatures": {
    "modelIds": [],
    "endpoints": ["/v1/fine-tunes"],
    "params": [],
    "symbols": [],
    "packages": [],
    "apiVersions": []
  },
  "replacement": {
    "value": "/v1/fine_tuning/jobs",
    "modelIds": []
  },
  "migrationNotes": [],
  "sources": [
    {
      "url": "https://developers.openai.com/api/docs/deprecations.md",
      "quote": "| 2024-01-04    | `/v1/fine-tunes` | `/v1/fine_tuning/jobs`  |",
      "contentHash": "b5d1cafefc8a491f2c095d77359a6ca185498baa5f65a66bac1cb722e188855f",
      "checkedAt": "2026-10-24T14:37:23.481Z"
    }
  ],
  "extraction": {
    "method": "table"
  },
  "status": "confirmed",
  "quarantineReasons": []
}
