{
  "schemaVersion": 1,
  "id": "openai-2027-01-20-gpt-4o-mini-realtime",
  "provider": "openai",
  "kind": "model-retirement",
  "title": "gpt-4o-mini-realtime shutdown",
  "summary": "Legacy audio, realtime, and transcription models. Shutdown date: 2027-01-20. Replacement: gpt-realtime-2.1-mini.",
  "announcedOn": "2026-07-20",
  "effectiveOn": "2027-01-20",
  "breaking": true,
  "signatures": {
    "modelIds": ["gpt-4o-mini-realtime"],
    "endpoints": [],
    "params": [],
    "symbols": [],
    "packages": [],
    "apiVersions": []
  },
  "replacement": {
    "value": "gpt-realtime-2.1-mini",
    "modelIds": ["gpt-realtime-2.1-mini"]
  },
  "migrationNotes": [],
  "sources": [
    {
      "url": "https://developers.openai.com/api/docs/deprecations.md",
      "quote": "| Jan 20, 2027  | `gpt-4o-mini-realtime`                                | `gpt-realtime-2.1-mini`             |",
      "contentHash": "b5d1cafefc8a491f2c095d77359a6ca185498baa5f65a66bac1cb722e188855f",
      "checkedAt": "2026-10-24T14:37:23.481Z"
    }
  ],
  "extraction": {
    "method": "table"
  },
  "status": "confirmed",
  "quarantineReasons": []
}
