{
  "schemaVersion": 1,
  "id": "openai-2026-05-12-dall-e-3",
  "provider": "openai",
  "kind": "model-retirement",
  "title": "dall-e-3 shutdown",
  "summary": "DALL·E model snapshots. Shutdown date: 2026-05-12. Replacement: gpt-image-2, gpt-image-1, or gpt-image-1-mini.",
  "announcedOn": "2025-11-14",
  "effectiveOn": "2026-05-12",
  "breaking": true,
  "signatures": {
    "modelIds": ["dall-e-3"],
    "endpoints": [],
    "params": [],
    "symbols": [],
    "packages": [],
    "apiVersions": []
  },
  "replacement": {
    "value": "gpt-image-2, gpt-image-1, or gpt-image-1-mini",
    "modelIds": ["gpt-image-2", "gpt-image-1", "gpt-image-1-mini"]
  },
  "migrationNotes": [],
  "sources": [
    {
      "url": "https://developers.openai.com/api/docs/deprecations.md",
      "quote": "| 2026-05-12    | `dall-e-3`     | `gpt-image-2`, `gpt-image-1`, or `gpt-image-1-mini` |",
      "contentHash": "b5d1cafefc8a491f2c095d77359a6ca185498baa5f65a66bac1cb722e188855f",
      "checkedAt": "2026-10-24T14:37:23.481Z"
    }
  ],
  "extraction": {
    "method": "table"
  },
  "status": "confirmed",
  "quarantineReasons": []
}
